{
    "profile": "default",
    "bucket": "",
    "folder": "",
    "include": [
        "**/**"
    ],
    "exclude": [
        "**/.DS_Store",
        "**/.git/**",
        "**/desktop.ini",
        "**/node_modules/**",
        "**/.simple-s3-sync.json",
        "**/.simple-s3-sync.trash/**"
    ],
    "synced": []
}